,term,definition
307,Aggressive Growth,"Funds in this objective seek rapid growth of capital. They often invest in small or emerging growth companies and are more likely than other funds to invest in initial public offerings (IPOs) and in companies with high price/earnings and price/book ratios. Aggressive growth funds may also use such investment techniques as heavy sector concentrations, leveraging, and short-selling."
308,Alpha,"Measures risk-adjusted performance. A positive Alpha indicates stronger performance than predicted by the fund's level of risk (measured by Beta). A negative Alpha represents weaker performance than predicted by a fund's Beta. Alpha and Beta are more reliable measures when used in combination with a high R2, which indicates a high correlation between the movements in a fund's returns and the movements in its benchmark. Alpha is annualized."
310,American Depositary Receipt (ADR),A negotiable receipt representing a specific number of equity shares in a foreign corporation. ADRs trade in American dollars in the American securities markets like domestic equities.
311,American Depositary Shares (ADS),"A trading unit for the issuer in the U.S. which may represent more or less than one underlying share of the issuer. ADSs are issued in New York in registered form, eligible for trading and clearing in the U.S. markets, and may be made eligible for clearing outside the U.S. in Euroclear and CEDEL."
312,Annual Report,"A yearly report or record of an investment's (e.g., mutual fund or stock) or company's financial position and operations."
313,Annuity,"A form of insurance contract that provided a steady stream of periodic payments, typically for life.  An annuity can be fixed or variable. A fixed annuity pays a set rate of interest that is adjusted periodically, while a variable annuity's payments are dependent on the performance of the underlying investment chosen by the annuitant."
314,Appreciation,An increase in the value of an investment.
317,Asset Allocation Funds,"Asset allocation funds have the ability to shift assets among asset classes (for example stocks (equities), bonds, and short-term investments). Asset allocation funds take the concept of a private asset manager - a skilled professional who builds and manages a comprehensive portfolio for a client - and apply it to a mutual fund."
319,Asset-backed Securities,"Bonds or notes backed by loan paper or accounts receivable originated by banks, credit card companies, or other providers of credit and often ""enhanced"" by a bank letter of credit or by insurance coverage provided by an institution other than the issuer."
320,Assets Covered,"Reported in Composition, this is the percentage of the portfolio's equity assets for which the corresponding portfolio characteristic is provided."
321,Auction Market,"A market for securities, typically found on a national securities exchange, in which trading in a particular security is conducted at a specific location with all qualified persons at that post able to bid or offer securities against orders via outcry."
322,Average Annual Total Return,"Average annual total return is a hypothetical rate of return that, if achieved annually, would have produced the same cumulative total return if performance had been constant over the entire period. Average annual total returns smooth out variation in performance; they are not the same as actual year-by-year results."
323,Back End Load,"A fee imposed by some funds when shares are redeemed (sold back to the fund) during the first few years of ownership.  The fee is calculated based on the value of the shares being sold. Many Back End Loads are progressive, meaning that the longer you hold the shares in the fund, the lower the fee becomes until in some cases it is eliminated altogether. A fee imposed by some funds when shares are redeemed (sold back to the fund) during the first few years of ownership."
324,Balanced,Balanced funds seek both income and capital appreciation by investing in a generally fixed combination of stocks and bonds. These funds generally hold a minimum of 25% of their assets in fixed-income securities at all times.
325,Bank Loan,"Bank-loan portfolios primarily invest in floating-rate bank loans instead of bonds. In exchange for their credit risk, these loans offer high interest payments that typically float above a common short-term benchmark such as the London Interbank Offered Rate, or LIBOR."
326,Basis Point,"One-hundredth of one percent, or 0.01%. For example, 20 basis points equal 0.20%. Investment expenses, interest rates and yield differences among bonds are often expressed in basis points."
328,Benchmark,"A standard against which the performance of a security, mutual fund or investment manager can be measured. Some well-known benchmarks are the Dow Jones Industrial Average and the S&P 500 Index."
330,Beta,"A historical measure of a fund's sensitivity to market movements calculated by comparing a fund's monthly returns, over 36 months, to those of the fund's benchmark. By definition, the Beta of the benchmark is 1.0. A Beta of less than 1.0 indicates that the fund is less sensitive to market movements, while a Beta greater than 1.0 indicates a fund that tends to be more sensitive to market movements. For example, a beta of 1.5 for a domestic stock fund indicates that over the last three years, the fund's monthly returns have fluctuated 50 percent more than the fund's benchmark, assuming that no other factors have affected the fund's returns. Generally, the higher the correlation between the fund and the market (as measured by R2), the more meaningful a Beta is. Because Beta is based on measurements of past performance, it is not an indication of what the fund's performance will be in the future."
331,Bill (Treasury or T-Bill),A government security with a maturity of a year or less.
332,Blue Chip Stocks,"Stocks of well-established companies that have had a history of earnings and dividend payments, as well as a reputation for sound management and quality of products and services. While not all large cap stocks are blue chip stocks, there is usually a large cap bias to blue chip stocks."
334,Bond Funds,A fund that invests primarily in bonds and other debt instruments.
335,Bond Rating,"A rating or grade that is intended to indicate the credit quality of a bond, considering the financial strength of its issuer and the likelihood that it will repay the debt. Agencies such as Standard & Poor's and Moody's Investors Service issue ratings for different bonds, ranging from AAA (highly unlikely to default) to D (in default)."
336,Broadly Diversified International Equity Funds,"Broadly diversified international equity funds generally fall into two categories: international funds, which do not invest in U.S. securities, and global funds, which invest anywhere in the world, including the U.S. Although they are both considered more aggressive than most domestic equity funds, broadly diversified funds are often considered to be a ""less aggressive"" type of international fund because of their typical emphasis on diversification within established markets. With these funds, risk is spread out across an expansive geographic area rather than concentrated in a single region or country. These funds are used by many investors to form the foundation of the international component of their portfolio."
338,Brokerage Window,A plan feature that permits participants to purchase investments that are not included among the plan's general menu of investment options.
339,Capital Appreciation,"If the value of an investment appreciates and you sell it at a higher price than you paid, you earn a profit, also known as a capital gain. If you sell shares at a lower price than you paid for them, you'll have a capital loss."
342,Capital Market,The market where securities such as stocks and bonds are traded.
343,Capital Preservation,An investment goal or objective to keep the original investment amount (the principal) from decreasing in value.
344,Capitalization or Cap,The total market value of a company's outstanding equity.
345,Cash & Other Category,"A mutual fund asset allocation theory that includes net cash, short-term securities, and any other securities (such as options) not included in other asset allocation categories."
346,Category Risk Learn More,"Morningstar assigns Category Risk Level to each group of mutual funds that invest in the same types of assets. These scores range from 1, for funds with the least amount of relative risk, to 10, for funds with the greatest amount. 


In determining the Category Risk Level, the scores based on the Morningstar Risk are reviewed by Morningstar's Research Committee. The Committee reviews the preliminary output, and makes changes where necessary, to ensure that the final scores are logically consistent and are updated to reflect current market conditions.


How Morningstar Calculates Category Risk Scores:

The first step is to determine the average Morningstar Risk for each category over the previous five years. Morningstar Risk is the difference between the Morningstar Return (excess total return over the risk free rate, adjusted for loads) and the Morningstar Risk Adjusted Return (excess total return over the risk free rate, adjusted for loads and risk). Risk is measured by the variations in a fund's  monthly total returns during the period, with greater risk leading to a lower risk-adjusted return.  The Morningstar Return and Morningstar Risk Adjusted Returns for each Category are found using equal weighted average of the total returns of all the funds in the category for a certain time period.  

The category's Morningstar Risk is then used as the starting point for the Category Risk Level assignments. Assignments can be modified in one of two ways. One method of modification is by logic. For instance, if one municipal bond category falls just across the dividing line from another municipal bond category, even though both invest in very similar types of assets, both categories are adjusted so that they are given the same risk assignment. They may also be adjusted by judgment. One example of this would be Long-Short Market Neutral stock funds. Although these funds tend to show very low risk scores based solely on the variations in their returns, the complexity of their strategies suggests that they should receive a higher risk score than the raw data indicates. In this case, the Category Risk score is adjusted accordingly."
347,CEDEL,An international clearing system that provides book-entry settlement and custody for certain instruments.
348,China Region,"China-region stock portfolios invest almost exclusively in stocks from China, Taiwan, and Hong Kong. These portfolios invest at least 70% of total assets in equities and invest at least 75% of stock assets in one specific region or a combination of China, Taiwan, and/or Hong Kong."
349,Class Inception,The date on which a specific share class of a fund opens to investors.
350,Closed-End Fund,A fund that does not issue and redeem shares. Closed funds are usually traded on a stock exchange.
351,Collateral Trust Bond,"Corporate debt security backed by other securities, usually held by a bank or other trustee. Such bonds are backed by collateral trust certificates and are usually issued by parent corporations that are borrowing against the securities of wholly owned subsidiaries."
352,Collateralized Mortgage Obligation (CMO),A mortgage-backed bond that separates mortgage pools into different maturity classes called tranches. This is accomplished by applying income (payments of principal and interest) from mortgages in the pool in the order the CMO's pay out.
353,Collective or Commingled Trust,"Investments created especially for employee benefit plans, such as 401(k) plans, that commingle the assets of qualified retirement plans for investment purposes. They are not available to the general public and therefore are not listed in the newspaper or others sources, and are not registered with the SEC."
354,Commission,A fee imposed when investments are bought or sold to compensate the broker or other salesperson for his or her role in the transaction.
355,Commodities Agriculture,"Agriculture portfolios invest in grain and feed products, oilseeds, cotton, dairy, livestock, poultry, and/or horticultural products. Investment can be made directly in physical assets or commodity-linked derivative instruments."
356,Commodities Broad Basket,"Broad-basket portfolios can invest in a diversified basket of commodity goods including but not limited to grains, minerals, metals, livestock, cotton, oils, sugar, coffee, and cocoa. Investment can be made directly in physical assets or commodity-linked derivative instruments, such as commodity swap agreements."
357,Commodities Energy,"Energy portfolios invest in oil (crude, heating, and gas), natural gas, coal, kerosene, diesel fuel, and propane. Investment can be made directly in physical assets or commodity-linked derivative instruments."
358,Commodities Industrial Metals,"Industrial-metals portfolios invest in such industrial metals as aluminum, copper, lead, nickel, and zinc. Investment can be made directly in physical assets or commodity-linked  derivative instruments."
359,Commodities Miscellaneous,Miscellaneous portfolios invest in a specific commodity that does not fit into any of Morningstar's existing commodity categories and for which not enough funds exist to merit the creation of a separate category.
360,Commodities Precious Metals,"Commodities precious-metals portfolios invest in precious metals such as gold, silver, platinum, and palladium. Investment can be made directly in physical assets or commodity-linked derivative instruments."
361,Commodity Instruments,"Securities that can be used to approximate the behavior of specific commodities. These include forwards, swaps, short-duration futures contracts, or derivatives. They are often used to hedge exposure to actual physical commodities."
362,Common Stocks,"Stocks represent a share in the ownership of a particular company. If the company does well, the value of each share generally goes up. Although common stocks have a history of long-term growth, their prices fluctuate based on changes in a company's financial condition and on overall market and economic conditions."
363,Communications,"Communications portfolios concentrate on telecommunications and media companies of various kinds. Most buy some combination of cable television, wireless-communications, and communications-equipment firms as well as traditional phone companies. A few favor entertainment firms, mainly broadcasters, film studios, publishers, and online service providers."
364,Company Stock,A plan investment option which invests primarily in employer securities and which may also maintain a cash position for liquidity purposes.
365,Competing Fund,A plan investment option that is identified by the investment manager of another option and which is subject to special rules relating to a participant's ability to buy and sell investments between the two investment options directly.
366,Composition,"This quantifies the securities held by the fund. Composition can be broken down into asset type, sector, and individual security. Composition may also show the weight, or percentage of the overall portfolio, for each holding."
367,Composition by Instrument,The makeup of a fund's portfolio expressed in terms of asset allocation and industry and sector diversification.
368,Composition by Quality,"Fidelity:
Credit ratings for a rated issuer or security held by our investment grade taxable and municipal bond funds and multi-asset class funds with a fixed income component, are categorized using the highest credit rating among the following three Nationally Recognized Statistical Rating Organizations (NRSRO): Moody's Investors Service (Moody's); Standard & Poor's Ratings Services (S&P); or Fitch, Inc. Credit ratings for a rated issuer or security held by our non-investment grade bond funds which include multi-asset class bond funds using a composite benchmark with more than half of its target allocation in high yield or emerging market debt, and real estate, emerging market debt and convertible security funds, are categorized using Moody's. If Moody's does not publish a rating for a security or issuer, then the S&P rating is used. When S&P and Moody's provide different ratings for the same issuer or security, the Moody's rating is used. For all funds, if none of these three NRSROs publishes a rating on the issuer or security, then the security is categorized as Not Rated. All U.S. government securities are included in the U.S. Government category. The table information is based on the combined investments of the fund and its pro rata share of any investments in other Fidelity funds.

Non-Fidelity:
Data provided by Morningstar, who surveys fund companies for the credit rating information on the funds underlying securities holdings on a periodic basis. Morningstar instructs fund companies to only use ratings that have been assigned by a Nationally Recognized Statistical Rating Organizations (NRSRO). If three or more NRSROs have rated the same security differently, fund companies are to report the middle rating; if two NRSROs have rated a security differently, fund companies are to report the lowest rating; if only one NRSRO has rated a security, fund companies are to report that rating. Securities not rated by an NRSRO are to be included in the Not Rated category. All U.S. Government Securities are included in the AAA category. If an NRSRO provides Morningstar with a short-term issue credit rating rather than a traditional fixed income credit rating for a cash security, Morningstar will translate that short-term issue rating to an equivalent fixed income credit rating as reflected in the Credit Quality Breakdown chart. Morningstar is not itself an NRSRO nor does it issue a credit rating on the fund or any securities held by the fund.

For Money Market Funds:
A Tier 1 security is a money market fund eligible security whose credit rating falls in the highest short-term rating category of the Nationally Recognized Statistical Rating Organizations. An unrated security is Tier 1 if it represents comparable quality to a rated security as defined by SEC Rule 2a-7 under the Investment Company Act of 1940. A Tier 2 Security is a money market fund eligible security that is not a Tier 1 security."
369,Compounding,"The cumulative effect that reinvesting earnings on an investment may have by generating additional earnings of their own, in addition to any earnings generated by the original investment."
370,Conservative,An investment approach that accepts lower rewards in return for potentially lower risks.
371,Conservative Allocation,"Conservative-allocation portfolios seek to provide both capital appreciation and income by investing in three major areas: stocks, bonds, and cash. These portfolios tend to hold smaller positions in stocks than moderate-allocation portfolios. These portfolios typically have 20% to 50% of assets in equities and 50% to 80% of assets in fixed income and cash."
372,Consumer Cyclical,Consumer cyclical portfolios seek capital appreciation by investing in equity securities of U.S. or non-U.S. companies in the consumer cyclical sector.
373,Consumer Defensive,"Consumer defensive portfolios seek capital appreciation by investing in equity securities of U.S. or non-U.S. companies that are engaged in the manufacturing, sales, or distribution of consumer staples."
374,Contingent Beneficiary,Anyone designated to receive a death benefit in the event of the death of the primary beneficiary. Also referred to as a secondary beneficiary.
375,Contingent Deferred Sales Charge (CDSC),A fee imposed when shares of a mutual fund or a variable annuity contract are redeemed (sold) during the first few years of ownership. Also called a back-end load.
376,Convertible Bond,"A corporate bond, usually a junior subordinated debenture, that can be exchanged for shares of the issuer's common stock."
377,Convertibles,"Convertible-bond portfolios are designed to offer some of the capital-appreciation potential of stock portfolios while also supplying some of the safety and yield of bond portfolios. To do so, they focus on convertible bonds and convertible preferred stocks. Convertible bonds allow investors to convert the bonds into shares of stock, usually at a preset price. These securities thus act a bit like stocks and a bit like bonds."
378,Convexity,A mathematical concept that measures the sensitivity of the market price of a bond to changes in interest rates.
379,Corporate Bond,"A bond issued by a corporation, rather than by a government. The credit risk for a corporate bond is based on the payment ability of the company that issued the bond. Credit risk is in addition to other risks associated with fixed-income investments such as inflation risk and interest rate risk."
380,Correlation Measures,"Measures that show the validity of a comparison between a portfolio and a benchmark, based on the historical relationship between portfolio returns and index returns."
381,Country Diversification,"Holdings are presented to illustrate examples of the countries or regions which the fund may invest, and may not be representative of the fund's current or future investments. Percentages are displayed for the top sectors as of the countries or regions as of the date stated. Percentages shown describe the portion of the fund's total net assets, unless otherwise stated."
382,Coupon Rate,The annual rate of interest payable on a debt security expressed as a percentage of the principal amount.
383,Coupon Yield,(see Nominal Yield).
384,Credit Quality,"Fidelity:
Credit ratings for a rated issuer or security held by our investment grade taxable and municipal bond funds and multi-asset class funds with a fixed income component, are categorized using the highest credit rating among the following three Nationally Recognized Statistical Rating Organizations (NRSRO): Moody's Investors Service (Moody's); Standard & Poor's Ratings Services (S&P); or Fitch, Inc. Credit ratings for a rated issuer or security held by our non-investment grade bond funds which include multi-asset class bond funds using a composite benchmark with more than half of its target allocation in high yield or emerging market debt, and real estate, emerging market debt and convertible security funds, are categorized using Moody's. If Moody's does not publish a rating for a security or issuer, then the S&P rating is used. When S&P and Moody's provide different ratings for the same issuer or security, the Moody's rating is used. For all funds, if none of these three NRSROs publishes a rating on the issuer or security, then the security is categorized as Not Rated. All U.S. government securities are included in the U.S. Government category. The table information is based on the combined investments of the fund and its pro rata share of any investments in other Fidelity funds.

Non-Fidelity:
Data provided by Morningstar, who surveys fund companies for the credit rating information on the funds underlying securities holdings on a periodic basis. Morningstar instructs fund companies to only use ratings that have been assigned by a Nationally Recognized Statistical Rating Organizations (NRSRO). If three or more NRSROs have rated the same security differently, fund companies are to report the middle rating; if two NRSROs have rated a security differently, fund companies are to report the lowest rating; if only one NRSRO has rated a security, fund companies are to report that rating. Securities not rated by an NRSRO are to be included in the Not Rated category. All U.S. Government Securities are included in the AAA category. If an NRSRO provides Morningstar with a short-term issue credit rating rather than a traditional fixed income credit rating for a cash security, Morningstar will translate that short-term issue rating to an equivalent fixed income credit rating as reflected in the Credit Quality Breakdown chart. Morningstar is not itself an NRSRO nor does it issue a credit rating on the fund or any securities held by the fund.

For Money Market Funds:
A Tier 1 security is a money market fund eligible security whose credit rating falls in the highest short-term rating category of the Nationally Recognized Statistical Rating Organizations. An unrated security is Tier 1 if it represents comparable quality to a rated security as defined by SEC Rule 2a-7 under the Investment Company Act of 1940. A Tier 2 Security is a money market fund eligible security that is not a Tier 1 security."
385,Credit Rating,"An assessment of the credit worthiness of individuals and corporations based upon the history of borrowing and repayment, as well as the availability of assets and the extent of liabilities."
386,Credit Risk,"The risk that a bond issuer will default, meaning not repay principal or interest to the investor as promised. Credit risk is also known as ""default risk""."
387,Cumulative Total Returns,Cumulative total return reflects actual performance over a stated period of time.
388,Currency,"Currency portfolios invest in multiple currencies through the use of short-term money market instruments; derivative instruments including and not limited to forward currency contracts, index swaps, and options; and cash deposits. These funds include both systematic currency traders and discretionary traders."
389,Currency Diversification,"The different currencies, expressed as a percentage, in which the fund's assets are issued."
390,Currency Fluctuations,Changes in the value of a currency in relationship to other major currencies. Currency fluctuations can have a significant effect on the value of international mutual funds.
