,term,definition
633,Morningstar Category,"In an effort to distinguish funds by what they own, as well as by their prospectus objectives and styles, Morningstar developed the Morningstar Categories. While the prospectus objective identifies a fund's investment goals based on the wording in the fund prospectus, the Morningstar Category classifies funds based on their investment styles as measured by their underlying portfolio holdings (portfolio statistics and compositions over the past three years). If the fund is new and has no portfolio, Morningstar estimates where it will fall before assigning a more permanent category. When necessary, Morningstar may change a category assignment based on current information."
634,Morningstar Category Average,"Morningstar Category classifies funds based on their investment styles as measured by their  holdings.  Measurements such as returns, risk, and expenses are grouped by category, with the mean for each measurement serving as the average."
635,Morningstar Overall Ratings,"The overall Morningstar RatingTM for a fund is derived from a weighted average of the performance figures associated with its three-, five-, and ten-year (if applicable) Morningstar Rating metrics. For each fund with at least a three-year history, Morningstar calculates a Morningstar Rating (based on a Morningstar Risk-Adjusted Return measure that accounts for variation in a funds monthly performance (including the effects of sales charges, loads and redemption fees), placing more emphasis on downward variations and rewarding consistent performance.
Morningstar distributes the stars accordingly:
"" The top 10% of funds in each category receive 5 stars
"" the next 22.5% receive 4 stars
"" the next 35% receive 3 stars
"" the next 22.5% receive 2 stars
"" the bottom 10% receive 1 star
Each share class is counted as a fraction of one fund within this scale and rated separately, which may cause slight variations in the distribution percentages."
636,Morningstar Return,"The Morningstar Return figure rates a fund's performance relative to other funds in its investment category. After adjusting for maximum front-end loads, applicable back-end loads, and applicable redemption fees, Morningstar calculates the excess return for each fund, defined as the fund's load-adjusted return minus the return for 90-day T-Bills over the same period. The use of excess instead of raw returns reflects our belief that mutual funds should be rated highly for only those returns earned beyond those of a T-Bill, which is essentially a risk-free investment. The excess returns are then compared with the higher of the average excess return of the fund's broad investment category or the 90-day T-Bill return. This last adjustment prevents distortions caused by having low or negative average excess returns in the equation's denominator, as might occur during a protracted down market. The return and risk assessments are based on a fund's historical performance relative to other funds in one of four broad investment categories (domestic equity, international equity, taxable bond, or municipal bond). It's important to realize that information is historical and purely quantitative. The assessments do not reflect Morningstar's opinion of the future potential of the fund; they only give a quick summary of how a fund has performed historically relative to its peers."
637,Morningstar Risk,"The Morningstar Risk statistic evaluates the fund's downside volatility relative to that of other funds in its broad investment category. Morningstar uses a proprietary risk measure that operates differently from traditional risk measures, such as beta and standard deviation, which see both greater- and less than-expected returns as added volatility. Morningstar believes that most investors' greatest fear is losing money, defined as underperforming the risk-free rate of return an investor can earn from the 90-day Treasury bill, so its risk measure focuses only on that downside risk. To calculate the risk score, Morningstar plots monthly fund returns in relation to T-Bill returns. The amounts by which the fund trails the T-Bill return is added each month and that total is divided by the period's total number of months. This number, the average monthly underperformance statistic, is then compared with those of other funds in the same broad investment category to assign a risk score. The resulting risk score expresses how risky the fund is relative to the average fund in its category. Note that Morningstar does not rate any fund that has less than three years of performance data."
638,"Morningstar, Inc.",A leading mutual fund research and tracking firm.
639,Mortgage-Backed Securities (MBS),"Securities backed by mortgages. Such certificates are issued by the Federal Home Loan Mortgage Corporation, and the Federal National Mortgage Association. Others are guaranteed by the Government National Mortgage Association. Investors receive payments out of the interest and principle on the underlying mortgages. Sometimes banks issue certificates backed by conventional mortgages, selling them to large institutional investors. The growth of mortgage-backed certificates and the secondary mortgage market in which they are traded has helped keep mortgage money available for home financing."
640,Moving Averages,An indicator frequently used in technical analysis showing the average value of a security's price over a set period. Moving averages are generally used to measure momentum and define areas of possible support and resistance.
641,Multialternative,These funds offer investors exposure to several different alternative investment tactics. Funds in this category have a majority of their assets exposed to alternative strategies. An investor's exposure to different tactics may change slightly over time in response to market movements. Funds in this category include both funds with static allocations to alternative strategies and funds tactically allocating among alternative strategies and asset classes. The gross short exposure is greater than 20%.
642,Multisector Bond,"Multisector-bond portfolios seek income by diversifying their assets among several fixed income sectors, usually U.S. government obligations, U.S. corporate bonds, foreign bonds, and high-yield U.S. debt securities. These portfolios typically hold 35% to 65% of bond assets in securities that are not rated or are rated by a major agency such as Standard & Poor's or Moody's at the level of BB (considered speculative for taxable bonds) and below."
643,Muni California Intermediate,"Muni California intermediate portfolios invest at least 80% of assets in California municipal debt. Because the income from these bonds is generally free from federal taxes and California state taxes, these portfolios are most appealing to residents of California. These portfolios have durations of 4.5 to 7.0 years (or, if duration is unavailable, average maturities of five to 12 years)."
644,Muni California Long,"Muni California long portfolios invest at least 80% of assets in California municipal debt. Because the income from these bonds is generally free from federal taxes and California state taxes, these portfolios are most appealing to residents of California. These portfolios have durations of more than 7.0 years (or, if duration is unavailable, average maturities of more than12 years)."
645,Muni Massachusetts,"Muni Massachusetts portfolios invest at least 80% of assets in Massachusetts municipal debt and can include long-, intermediate-, and short-duration portfolios. Because the income from these bonds is generally free from federal taxes and Massachusetts state taxes, these portfolios are most appealing to residents of Massachusetts."
646,Muni Minnesota,"Muni Minnesota portfolios invest at least 80% of assets in Minnesota municipal debt and can include long-, intermediate-, and short-duration portfolios. Because the income from these bonds is generally free from federal taxes and Minnesota state taxes, these portfolios are most appealing to residents of Minnesota."
647,Muni National Intermediate,"Muni national intermediate portfolios invest in bonds issued by various state and local governments to fund public projects. The income from these bonds is generally free from federal taxes. To lower risk, these portfolios spread their assets across many states and sectors. These portfolios have durations of 4.5 to 7.0 years (or, if duration is unavailable, average maturities of five to 12 years)."
648,Muni National Long,"Muni national long portfolios invest in bonds issued by various state and local governments to fund public projects. The income from these bonds is generally free from federal taxes. To lower risk, these portfolios spread their assets across many states and sectors. These portfolios have durations of more than 7.0 years (or, if duration is unavailable, average maturities of more than 12 years)."
649,Muni National Short,"Muni national short portfolios invest in bonds issued by state and local governments to fund public projects. The income from these bonds is generally free from federal taxes and/or from state taxes in the issuing state. To lower risk, some of these portfolios spread their assets across many states and sectors. Other portfolios buy bonds from only one state in order to get the state-tax benefit. These portfolios have durations of less than 4.5 years (or, if duration is unavailable, average maturities of less than five years)."
650,Muni New Jersey,"Muni New Jersey portfolios invest at least 80% of assets in New Jersey municipal debt and can include long-, intermediate-, and short-duration portfolios. Because the income from these bonds is generally free from federal taxes and New Jersey state taxes, these portfolios are most appealing to residents of New Jersey."
651,Muni New York Intermediate,"Muni New York intermediate portfolios invest at least 80% of assets in New York municipal debt. Because the income from these bonds is generally free from federal taxes and New York state taxes, these portfolios are most appealing to residents of New York. These portfolios have durations of 4.5 to 7.0 years (or, if duration is unavailable, average maturities of five to 12 years)."
652,Muni New York Long,"Muni New York long portfolios invest at least 80% of assets in New York municipal debt. Because the income from these bonds is generally free from federal taxes and New York state taxes, these portfolios are most appealing to residents of New York. These portfolios have durations of more than 7.0 years (or, if duration is unavailable, average maturities of more than 12 years)."
653,Muni Ohio,"Muni Ohio portfolios invest at least 80% of assets in Ohio municipal debt and can include long-, intermediate-, and short-duration portfolios. Because the income from these bonds is generally free from federal taxes and Ohio state taxes, these portfolios are most appealing to residents of Ohio."
654,Muni Pennsylvania,"Muni Pennsylvania portfolios invest at least 80% of assets in Pennsylvania municipal debt and can include long-, intermediate-, and short-duration portfolios. Because the income from these bonds is generally free from federal taxes and Pennsylvania state taxes, these portfolios are most appealing to residents of Pennsylvania."
655,Muni Single State Intermediate,"Muni single-state intermediate portfolios invest in bonds issued by state and local governments to fund public projects. The income from such bonds is generally free from federal taxes and from state taxes in the issuing state. To get the state-tax benefit, these portfolios buy bonds from only one state. These portfolios have durations of 4.5 to 7.0 years (or, if duration is unavailable, average maturities of five to 12 years)."
656,Muni Single State Long,"Muni single-state long portfolios invest in bonds issued by state and local governments to fund public projects. The income from such bonds is generally free from federal taxes and from state taxes in the issuing state. To get the state-tax benefit, these portfolios buy bonds from only one state. These portfolios have durations of more than 7.0 years (or, if duration is unavailable, average maturities of more than 12 years)."
657,Muni Single State Short,"Muni single-state short portfolios invest in bonds issued by state and local governments to fund public projects. The income from such bonds is generally free from federal taxes and from state taxes in the issuing state. To get the state-tax benefit, these portfolios buy bonds from only one state. These portfolios have durations of less than 4.5 years (or, if duration is unavailable, average maturities of less than five years)."
658,Municipal Securities,"A general term referring to securities issued by local governmental subdivisions such as cities, towns, villages, counties or special districts, as well as securities issued by states and political subdivisions or agencies of states. A prime feature of these securities is that interest on them is generally exempt from federal income taxes and, in some cases, state and local taxes too."
659,Mutual Fund,"An investment that pools investors' money and invests it with a specific objective in mind. Investors do not own the securities purchased by the fund. Instead, they own shares in the fund."
660,Mutual Fund Share Price,The dollar value of one share of an investment in a mutual fund.
661,Natural Resources,"Natural-resources portfolios focus on commodity-based industries such as energy, chemicals, minerals, and forest products in the United States or outside of the United States. Some portfolios invest across this spectrum to offer broad natural-resources exposure. Others concentrate heavily or even exclusively in specific industries. Portfolios that concentrate primarily in energy-related industries are part of the equity energy category."
662,NAV Change,The difference between today's closing net asset value (NAV) and the previous day's closing net asset value (NAV).
663,NAV Change %,The percentage change between mutual fund's current and previous day's closing net asset value (NAV).
664,Net Asset Value (NAV),"The dollar value of one mutual fund' share, excluding any sales charges or redemption fees. The NAV is calculated by subtracting liabilities from the value of a fund's total assets and dividing it by the number of fund' shares outstanding."
665,Net Assets,Difference between a company's total assets and liabilities.
666,Net Unrealized Appreciation (NUA),The reference to special tax treatment that is available to participants who own employer securities in a qualified retirement plan if certain requirements are met.
667,Net Yield,"Rate of return on a security net of out-of-pocket costs associated with its purchase, such as commissions or markups."
668,New York Stock Exchange (NYSE),"The largest stock exchange in the United States. It is a corporation, operated by a board of directors, and it is responsible for setting policy, supervising Exchange and member activities, listing securities, overseeing the transfer of members' seats on the Exchange and judging whether an applicant is qualified to be a specialist."
669,Nominal Yield (Coupon Yield),"The stated interest rate paid on a bond, computed by dividing the amount of annual income by the bond's par value."
670,Non-Load Adj. Returns,"These total returns represent the change in share price and include the reinvestment of all dividends and capital gains, if any, but do not include the effect of sales charges and redemption fees. If these fees were included, the returns would be lower. Each fund's share price and return will vary and shares, when redeemed, may be worth more or less than their original cost. Click on the fund name for more information.""YRedundant ."
671,Non-Load-Adjusted Returns,"These total returns represent the change in share price and include the reinvestment of all dividends and capital gains, if any, but do not include the effect of sales charges and redemption fees. If these fees were included, the returns would be lower. Returns are listed for the trailing one-, three-, five-, and 10-year periods. For funds that lack a 10-year history, Morningstar provides an annualized non-load-adjusted return figure for the period since the fund's inception. Each fund's share price and return will vary and shares, when redeemed, may be worth more or less than their original cost. Click on the fund name for more information.
Note
A debt obligation similar to a bond, but with a maturity date less than five years from date of issue."
672,Nontraditional Bond,"The Nontraditional Bond category contains funds that pursue strategies divergent in one or more ways from conventional practice in the broader bond-fund universe. Many funds in this group describe themselves as ""absolute return"" portfolios, which seek to avoid losses and produce returns uncorrelated with the overall bond market; they employ a variety of methods to achieve those aims. Another large subset are self-described ""unconstrained"" portfolios that have more flexibility to invest tactically across a wide swath of individual sectors, including high-yield and foreign debt, and typically with very large allocations. Funds in the latter group typically have broad freedom to manage interest-rate sensitivity, but attempt to tactically manage those exposures in order to minimize volatility. The category is also home to a subset of portfolios that attempt to minimize volatility by maintaining short or ultra-short duration portfolios, but explicitly court significant credit and foreign bond market risk in order to generate high returns. Funds within this category often will use credit default swaps and other fixed income derivatives to a significant level within their portfolios."
673,Note,"A debt obligation similar to a bond, but with a maturity date less than five years from date of issue."
674,Offer Price,"The lowest price that a seller is willing to accept from a prospective buyer. In the case of a mutual fund with a sales charge, this price is the net asset value (NAV) plus the sales charge. In the case of no-load funds, it is the NAV."
675,Offering Date,The date on which a distribution of stocks or bonds will first be available to the public.
676,Opportunity Risk,The risk that a better opportunity may present itself after you have already committed your money elsewhere.
677,Option Adjusted Duration,"Option adjusted duration estimates how much a bond's price fluctuates with changes in comparable interest rates. If rates rise 1.00%, for example, a fund with a 5-year duration is likely to lose about 5.00% of its value. Other factors also can influence a bond fund's performance and share price. A bond fund's actual performance may differ.
Source: FMR Co."
678,Pacific/Asia ex-Japan Stock,"Pacific/Asia ex-Japan stock portfolios cover a wide geographic range. Most of these portfolios focus on export-oriented nations such as Hong Kong, Singapore, Taiwan, and Korea. These portfolios invest at least 70% of total assets in equities and invest at least 75% of stock assets in Pacific countries, with less than 10% in Japan."
679,Paper,Any short-term debt security.
680,Par,The nominal or face value of a security as given on the certificate or instrument. The par value is the amount on which interest payments are calculated.
681,Passive Management,The process or approach to operating or managing a fund in a passive or non-active manner typically with the goal of mirroring an index. These funds are often referred to as index funds and differ from mutual funds that are actively managed.
682,Payout Annuity,"When the assets in a tax-deferred annuity are converted into a guaranteed lifetime income, an annuity contract becomes a payout annuity. This is also known as asset becoming annuitized."
683,Performance,The results of an investment over a period of time.
685,Portfolio Data,"For Equity Funds, turnover rate is a measure of the fund's trading activity calculated by dividing total purchases or sales of portfolio securities (whichever is lower) by the fund's net assets.  For the fixed income investments, duration estimates how much a bond fund's price will change with a change in comparable interest rates  Weighted average maturity is a weighted average of all the maturities of the securities held in a fund. WAM can be used as a measure of sensitivity to interest rate changes and markets changes. For money market funds, weighted average life is the weighted average of the life of the securities held in a fund or portfolio and can be used as a measure of sensitivity to changes in liquidity and/or credit risk. Generally, the higher the value, the greater the sensitivity."
686,Portfolio Diversification,The makeup of a fund's portfolio expressed in terms of asset allocation and industry and sector diversification.
687,Portfolio Turnover Rate,"A measure of how frequently investments are bought and sold within an investment option over a period of time, typically one year. The portfolio turnover rate is usually expressed as a percentage of the total value of an investment option."
688,Portfolio Weight,The percentage of a specific security or asset type that is contained in a mutual fund.
689,Premium,The amount by which a bond sells above its par (face) value.
690,Present Value,"The value at the current time of a cash payment which is expected to be received in the future, discounted to reflect the fact that an amount received today could be invested to earn interest for the period to the future date."
691,Price/Book,The ratio of a company's current share price to reported accumulated profits and capital.
692,Price/Cash Flow,The ratio of a company's current share price to reported cash flow.
693,Primary Market (New Issue Market),"The market on which newly issued securities are sold, including government security auctions and underwriting purchases of blocks of new issues, which are then resold."
695,Prospectus,"The official document that describes an investment to prospective investors. The prospectus contains information required by the SEC, such as investment objectives and policies, risks, services, and fees."
696,Quantitative Funds,"Mutual funds whose portfolio management decisions are based on quantitative analysis, which is usually developed using computerized statistical models of market behavior."
697,Quarter-End Average Annual Total Returns,"Quarter-end Average annual total return is a rate of return on a quarterly basis that, if achieved annually, would have produced the same cumulative total return if performance had been constant over the entire period. Average annual total returns smooth out variation in performance; they are not the same as actual year-by-year results."
698,R2,"A measurement of how closely the portfolio's performance correlates with the performance of a benchmark index, such as the S&P 500. R2 is a proportion which ranges between 0.00 and 1.00. An R2 of 1.00 indicates perfect correlation to the benchmark index, that is, all of the portfolio's fluctuations are explained by performance fluctuations of the index, while an R2 of 0.00 indicates no correlation. Therefore, the lower the R2, the more the fund's performance is affected by factors other than the market as measured by that benchmark index."
699,Rate Information,"Displays payment data for an annuity, including the current and guaranteed payment rate and the period of time that the issuing company agrees to make payments."
700,Rate of Return,The gain or loss on an investment over a period of time. The rate of return is typically reported on an annual basis and expressed as a percentage.
701,Ratings,Designations used by investors' services to give relative indications of credit quality.
702,Real Estate,"Real estate portfolios invest primarily in real estate investment trusts of various types. REITs are companies that develop and manage real estate properties. There are several different types of REITs, including apartment, factory-outlet, health-care, hotel, industrial, mortgage, office, and shopping center REITs. Some portfolios in this category also invest in real estate operating companies."
703,Real Estate Investment Trust - REIT,"A company, usually traded publicly, that manages a portfolio for real estate to earn profits for shareholders."
704,Real Rate of Return,Rate of return on an investment adjusted for inflation.
705,Rebalance,The process of moving money from one type of investment to another to maintain a desired asset allocation.
706,Redemption,To sell fund shares back to the fund.  Redemption can also mean the repayment of a bond on or before the agreed upon pay-off date.
707,Redemption Fee,See Short-Term Redemption Fee.
708,Regional Diversification,"Holdings are presented to illustrate examples of the countries or regions which the fund may invest, and may not be representative of the fund's current or future investments. Percentages are displayed for the top sectors as of the countries or regions as of the date stated. Percentages shown describe the portion of the fund's total net assets, unless otherwise stated."
709,Reinvesting,"Using any dividends, interest and capital gains earned in an investment or mutual fund to purchase additional shares or units."
710,Reinvestment Price,"The price at which additional shares of a fund are purchased using the proceeds of money distributed by that fund, usually in the form of capital gains or dividends."
711,Relative Volatility,A ratio of a portfolio's standard deviation to the standard deviation of a benchmark index.
712,Retirement Income,"Retirement income portfolios provide a mix of stocks, bonds, and cash for those investors already in or entering retirement. These portfolios tend to be managed to more of a conservative asset-allocation strategy. These portfolios aim to provide investors with steady income throughout retirement."
