,term,definition
0,1099-DIV,A tax form that reports dividends or distributions earned on stocks or mutual funds.
1,1099-B,A tax form that reports gains and losses from selling stocks or other investments in a brokerage account.
2,401(k) Plan,"A defined contribution plan where an employer deducts money from an employee's salary and places it into a tax-deferred retirement account. Taxes are paid upon withdrawal, and early withdrawals incur penalties."
3,529 Plan,"A U.S. state-sponsored, tax-advantaged investment plan for educational expenses, including college, trade school, or K-12 tuition."
4,After-Tax (Dollars/Contributions),Money that has already been taxed.
5,Alternative Minimum Tax (AMT),"A tax system ensuring taxpayers with certain types of income (e.g., incentive stock options) pay a minimum level of tax."
6,Annual Contribution Limits,IRS rules determining how much can be contributed to retirement accounts each year.
7,Annualized Return,"The average annual gain or loss of an investment over a specific period, accounting for compound growth."
8,Asset Allocation,"An investment strategy balancing asset classes (stocks, bonds, cash) based on goals, risk tolerance, and timeline."
9,Asset Class,"One of the three major types of investments: stocks, bonds, and cash equivalents."
10,Award Agreement,"A document detailing the terms of a stock grant, including shares, award price, and vesting schedule."
11,Award Price,"The price paid per share when exercising stock options, also called exercise price, grant price, option price, or strike price."
12,Bear Market,A market where share prices decline more than 20% from a recent high.
13,Beneficiary,A person or entity designated to receive benefits or assets.
14,Blue-Chip Stock,"Shares of large, financially sound companies that are industry leaders."
15,Bond,"A loan made to a government, municipality, or corporation in exchange for periodic interest payments and repayment of the principal."
16,Bond Ladder,A portfolio of bonds with staggered maturity dates to minimize interest rate risk and provide steady income.
17,Broker,"An intermediary between buyers and sellers of securities, often charging a commission."
18,Brokerage Account,"A taxable account for investing in stocks, bonds, ETFs, mutual funds, and other securities."
19,Bull Market,A market where share prices rise 20% or more from recent lows.
20,Capital Gain,Profit from selling an investment at a higher price than its purchase price.
21,Capital Gains Tax,Tax on profits from selling capital assets. Long-term gains (held over a year) are taxed at lower rates than short-term gains.
22,Capital Loss,Loss from selling an investment at a lower price than its purchase price.
23,Certificate of Deposit (CD),A federally insured bank deposit with a fixed interest rate and maturity date.
24,Certified Financial Planner™ (CFP®),"A professional who meets education, experience, and ethical standards to provide financial planning services."
25,Cliff,The date when vesting restrictions for restricted stock or options end.
26,Common Stock,"Partial ownership of a company, granting voting rights and potential dividends."
27,Compound Growth,Reinvesting earnings to increase total investment value over time.
28,Cost Basis,The original price paid for an investment.
29,Cryptocurrency,A virtual currency secured by cryptography and recorded on a blockchain.
30,Diversification,An investment strategy mixing asset classes and investments to reduce risk.
31,Dividends,"Portions of a company's earnings distributed to shareholders, often in cash or additional shares."
32,Dollar-Cost Averaging,"Investing a fixed amount regularly, regardless of share price."
33,Dow Jones Industrial Average (DJIA),A stock market index tracking 30 prominent U.S. companies.
34,Earned Income,"Taxable income from employment or self-employment, excluding investment or retirement income."
35,Earnings Season,The period when corporations report quarterly earnings.
36,Employee Stock Option Exercise and Equity Award Agreement,A document authorizing a brokerage firm to act on behalf of an employee in equity award transactions.
37,Employee Stock Purchase Plan (ESPP),A plan allowing employees to buy company stock at a discount through payroll deductions.
38,Employer-Sponsored Retirement Account,"A retirement plan provided by an employer, such as a 401(k) or 403(b), often with tax benefits and employer matching."
39,Equity Compensation,"Compensation based on company stock, including stock options, restricted stock, or performance awards."
40,Equity Security,"Partial ownership of a company, granting voting rights and potential dividends."
41,Exchange-Traded Fund (ETF),"A fund holding assets like stocks or bonds, traded on exchanges like stocks."
42,Exercise,Acting on the right to purchase company stock at the grant price.
43,Exercise and Hold,Purchasing company stock at the grant price and holding the shares for future sale.
44,Exercise and Sell,Purchasing and immediately selling company stock.
45,Exercise Date,The date on which stock options are exercised.
46,Exercise Price,"The price paid per share when exercising stock options, also called award price, grant price, or strike price."
47,Fair Market Value (FMV),The price a willing buyer would pay a willing seller for a share of stock.
48,Fractional Share,"A portion of a share, allowing investment based on dollar amounts."
49,Futures,Contracts to buy or sell an asset at a set price on a future date.
50,Grant,"An award of stock options, restricted stock units (RSUs), or performance stock units (PSUs)."
51,Grant Agreement,"A document detailing the terms of a stock grant, including shares, award price, and vesting schedule."
52,Grant Date,"The date stock options, RSUs, or PSUs are granted."
53,Grant ID,A unique identifier for each equity award.
54,Grant Price,"The price of the award at the time of the grant, also called award price, strike price, or exercise price."
55,Holding Period,The time an investment is held to qualify for favorable tax treatment.
56,Incentive Stock Options (ISOs),"Tax-advantaged stock options under U.S. tax law, with potential AMT implications."
57,Index,"A group of securities representing a market, sector, or commodity, such as the S&P 500 or NASDAQ."
58,Individual Retirement Account (IRA),A retirement account with tax advantages for individuals with earned income.
59,Initial Public Offering (IPO),The process of offering shares of a private company to the public for the first time.
60,In-the-Money Stock Options,Stock options with a market price higher than the grant price.
61,Invest,Putting money into assets like stocks or bonds with the goal of financial gain.
62,Lapse,The date when vesting restrictions for restricted stock or options end.
63,Lookback,A feature in ESPPs allowing stock purchase at the lower of two prices: the offering period's start or end date.
64,Market Price,The current price of a stock in the market.
65,Modified Adjusted Gross Income (MAGI),Adjusted gross income with certain deductions and income added back.
66,Mutual Funds,Investment funds pooling money from many investors to buy a diversified portfolio of assets.
67,Non-Fungible Tokens (NFTs),"Unique digital assets stored on a blockchain, often representing art or collectibles."
68,Non-Qualified Stock Options (NQSOs),Stock options not meeting IRS requirements for tax-advantaged treatment.
69,Option Price,"The price paid per share when exercising stock options, also called award price, strike price, or grant price."
70,Penny Stock,"A stock trading for less than $5 per share, not listed on a major U.S. exchange."
71,Performance Stock Units (PSUs) and Performance Stock Awards (PSAs),Equity compensation awarded based on company performance and service requirements.
72,Portfolio,A collection of investments held by an individual or institution.
73,Preferred Stock,A class of stock with priority over common stock for dividends and assets.
74,Pre-Tax (Dollars/Contributions),Money that has not yet been taxed.
75,Qualified Stock Options,See Incentive Stock Options (ISOs).
76,Rebalancing,Adjusting a portfolio to maintain the desired asset allocation.
77,Required Minimum Distributions (RMDs),IRS-mandated withdrawals from tax-deferred retirement accounts starting at a certain age.
78,Restricted Stock Awards (RSAs) and Restricted Stock Units (RSUs),Equity compensation awarded at a future date upon meeting service requirements.
79,Risk Tolerance,An investor's willingness to take on risk.
80,Robo-Advisor,An automated service creating and managing investment portfolios based on user preferences.
81,Rollover IRA,An IRA allowing funds from an employer-sponsored retirement plan to be transferred without tax penalties.
82,Roth IRA,"A retirement account funded with after-tax dollars, allowing tax-free growth and withdrawals."
83,Sale Price,The market price at which a security is sold.
84,Security,"A tradable financial asset like stocks, bonds, or ETFs."
85,Securities and Exchange Commission (SEC),A U.S. government agency regulating securities markets and protecting investors.
86,Share,"Partial ownership of a company, granting voting rights and potential dividends."
87,Short Selling,Borrowing and selling a security with the intention of buying it back at a lower price.
88,Spread,The difference between an equity award price and the fair market value of stock.
89,Standard and Poor's S&P 500® Index,A stock market index tracking 500 large U.S. companies.
90,Stock Appreciation Rights (SARs),"Equity compensation tied to a company's stock performance, paying out in cash or stock."
91,Stock,"Partial ownership of a company, granting voting rights and potential dividends."
92,Stock Option,The right to buy company stock at a specific price within a set period.
93,Stock Slices,Fractional shares allowing investment based on dollar amounts.
94,Stock Symbol,"A unique identifier for a publicly traded security, also called a ticker symbol."
95,Stock Ticker,The continuously updated price of a security during trading hours.
96,Strike Price,"The price paid per share when exercising stock options, also called award price, grant price, or option price."
97,Tax-Deferred,Contributions and earnings not taxed until withdrawn from a retirement account.
98,Tax-Loss Harvesting,Selling securities at a loss to offset capital gains and reduce taxes.
99,Thematic Investing,"Investing based on trends or themes, such as technology or sustainability."
100,Ticker Symbol,"A unique identifier for a publicly traded security, also called a stock symbol."
101,Time Horizon,The period until an investor plans to withdraw invested funds.
102,Traditional IRA,"A retirement account with pre-tax contributions and tax-deferred growth, taxed upon withdrawal."
103,Underwater,When the award price of stock options exceeds the current market price.
104,Unvested Grant,A grant that has not yet met vesting criteria.
105,Vest/Vesting,The process by which an equity award becomes non-forfeitable.
106,Vested Grant,"A grant that has met vesting criteria, often triggering tax withholding."
107,Vesting Period,The time required for an equity award to vest.
108,Vesting Schedule,A timeline outlining when equity awards vest.
109,Volatility,The fluctuation of a stock's price or market prices.
110,W-8BEN,An IRS form for non-U.S. citizens to certify foreign status and reduce tax withholding.
111,W-9,An IRS form for U.S. persons to certify their Taxpayer Identification Number and exemption from backup withholding.
112,1/1 ARM,"An adjustable-rate mortgage that has a set initial interest rate for the first year. After that period, the mortgage rate adjusts each year. Each annual rate adjustment is based on (or âindexed toâ) another rate, often the yield on a U.S. Treasury note."
113,10/1 ARM,"An adjustable-rate mortgage that has a set initial interest rate for the first 10 years. After that period, the mortgage rate adjusts each year."
114,3/1 Interest-Only ARM,An adjustable rate mortgage in which none of the payments go toward paying off the loan principal for the first three years.
115,3-in-1 Credit Report,"Also called a merged credit report, this type of report includes your credit data from TransUnion, Equifax, and Experian in a side-by-side format for easy comparison."
116,80-10-10 Loan,"A combination of an 80% loan-to-value first mortgage, a 10% home equity loan, and a 10% down payment. The loans can be used to eliminate the need for private mortgage insurance."
117,ACH,"Automated Clearing House. This is a national network that allows for transferring funds electronically between businesses, consumers, and financial institutions."
118,Adjustable Rate Mortgage (ARM),"A home loan where the interest rate is changed periodically based on a standard financial index. ARMâs offer lower initial interest rates with the risk of rates increasing in the future. In comparison, a fixed rate mortgage (FRMâs) offers a higher rate that will not change for the length of the loan. ARMs often have caps on how much the interest rate can rise or fall."
119,Alternative Mortgage,"Any home loan that is not a standard fixed-rate mortgage. This includes ARMâs, reverse mortgages, and jumbo mortgages."
120,Alias,A note on your credit report that indicates other names used for your financial accounts. Sometimes marked as âAlso Known Asâ or âAKA.â This can include maiden names or variations on the spelling and format of your full name.
121,Amortization,The process of gradually repaying a debt with regularly scheduled payments over a period of time.
122,AnnualCreditReport.com,"The official website for obtaining your free credit report disclosures from the credit bureaus, Equifax, Experian, and TransUnion. You have the right to request your credit reports online, by phone, or by mail for free once every 12 months under FACT Act regulations. This free service can only be used once a year and does not include your credit scores."
123,Annual Fee,A charge sometimes required by credit card companies for use of an account. Annual fees range between $10-50 a year and are most common with rewards cards or cards for subprime borrowers.
124,Annual Percentage Rate (APR),"The interest rate being charged on a debt, expressed as a yearly rate. Credit cards often have several different APRsâone for purchases, one for cash advances, and one for balance transfers."
125,Application Fee,"Amount a lender charges to process your loan application documents. Application fees are common with mortgage loans, and many lenders will apply the cost of the application fee towards your closing costs. Application fees are generally non-refundable."
126,Application Scoring,"A specific kind of statistical scoring that businesses use to evaluate an applicant for acceptance or denial. Similar to credit scoring, application scoring often factors in other relevant details such as employment status and income to determine risk."
127,Appraisal Fee,"The amount charged to deliver a professional opinion about how much a property is worth. For a standard home or condominium, this fee is usually around $200-500."
128,Appraised Value,"An educated opinion of how much a property is worth. An appraiser considers the price of similar homes in the area, the condition of the home, and the features of the property to estimate the value."
129,ARM (Adjustable Rate Mortgage),"A mortgage that has an interest rate which changes over the life of the loan, usually increasing at regular intervals."
130,Asset,"Assets are things owned by a person that have cash value. This can include homes, cars, boats, savings, and investments."
131,Authorized User,"Anyone who uses your credit cards or credit accounts with your permission. More specifically, someone who has a credit card from your account with their name on it. An authorized user is not legally responsible for the debt. However, the account may appear on their credit report, which means it may also be included in the authorized user's credit score calculation."
132,Back-End Ratio or Back Ratio,"The sum of your monthly mortgage payment and all other monthly debts (credit cards, car payments, student loans, etc.) divided by your monthly pre-tax income. Traditionally, lenders wouldnt give people loans that increased this ratio past 36%, but they often do now. (See Debt-to-Income Ratio)"
133,Balance Transfer,The process of moving all or part of the outstanding balance on one credit card to another account. Credit card companies often offer special rates for balance transfers.
134,Balance Transfer Fee,The fee charged customers for transferring an outstanding balance from one credit card to another. Card issuers offer teaser rates to encourage balance transfers.
135,Balloon Payment,"A loan where the payments dont pay off the principal in full by the end of the term. When the loan term expires (usually after 5-7 years), the borrower must pay a balloon payment for the remaining amount or refinance. Balloon loans sometimes include convertible options that allow the remaining amount to automatically be transferred into a long-term mortgage. (See Convertible ARM)"
136,Bankruptcy,A proceeding that legally releases a person from repaying a portion or all debts owed. Bankruptcy damages your credit for 7-10 years and should only be considered as a last resort if you cannot repay your debts. (See Chapter 7-13 Bankruptcy)
137,Beacon Score,"The name of the FICO score from Equifax. There are thousands of slightly different credit scoring formulas used by bankers, lenders, creditors, insurers, and retailers. Each score can vary somewhat in how it evaluates your credit data."
138,Bi-Weekly Mortgage,A mortgage that schedules payments every two weeks instead of the standard monthly payment. The 26 bi-weekly payments are each equal to one-half of a monthly payment. The result is that the mortgage is paid off sooner.
139,Broker Premium,The amount a mortgage broker is paid for serving as the middleman between a lender and a borrower. This premium comes from the surcharge a broker applies to a discounted loan before offering it to a borrower.
140,Borrower,The individual who is requesting the loan and who will be responsible for paying it back.
141,Cardholder,The person who is issued a credit card and/or any authorized users.
142,Cash Advance,"A cash loan requested from your creditor, usually by using your credit card at an ATM machine or through a loan advance on your paycheck. These loans include special interest rates charged on the amount of the advance."
143,Cash Advance Fee,A charge by the bank for using credit cards to obtain cash from the available cash. This fee can be stated in terms of a flat per transaction fee or a percentage of the amount of cash advance.
144,Cash-Out Refinance,A new mortgage for an existing property in which the amount borrowed is greater than the amount of the previous mortgage. The difference is given to the borrower in cash when the loan is closed.
145,Chapter 7 Bankruptcy,"A type of consumer bankruptcy where your responsibility for your debts is cleared entirely. With this kind of bankruptcy, you are not required to pay back debts you owe from before your filing. To qualify for a Chapter 7 bankruptcy, your income must be below your state's median income. Chapter 7 bankruptcy filing records remain on your credit report for 10 years, and the record of each account included in your filing will remain on your report for 7 years."
146,Chapter 11 Bankruptcy,A complex type of bankruptcy usually filed by businesses that wish to restructure their debts.
147,Chapter 12 Bankruptcy,A type of bankruptcy specifically for farmers and fishermen. Similar to Chapter 13 bankruptcy but with a few special benefits.
148,Chapter 13 Bankruptcy,A type of bankruptcy where the consumer must pay off some of their debts over time. Chapter 13 bankruptcy filing records remain on your credit report for 7 years from the discharge date or 10 years from the filing date if it is not discharged. Each account included in the filing will remain on your report for 7 years.
149,Charge-Off,"When a creditor or lender writes off the balance of a delinquent debt, no longer expecting it to be repaid. A charge-off is also known as a bad debt. Charge-off records remain on your credit report for 7 years and will harm your credit score. After a debt is charged-off, it can be sold to a collections agency."
150,ChexSystems,"A credit reporting company that tracks your banking history and provides this data to banks when you apply for a new checking account. Negative records, such as bounced checks, can be kept in their database for up to five years. If there are errors on your ChexSystems record, you can contact the company to submit a dispute."
151,Closing Costs,"The amounts charged to a consumer when they are transferring ownership or borrowing against a property. Closing costs include lender, title, and escrow fees and usually range from 3-6% of the purchase price."
152,Collateral,An asset or property used as security against a loan. (See Secured Credit Card)
153,Collections,"When a business sells your debt for a reduced amount to an agency in order to recover the amounts owed. Credit card debts, medical bills, cell phone bills, utility charges, library fees, and video store fees are often sold to collections. Collection agencies attempt to recover past-due debts by contacting the borrower via phone and mail. Collection records can remain on your credit report for 7 years from the last 180-day late payment on the original debt. Your rights are defined by the Fair Debt Collection Practices Act."
154,Combined Loan-to-Value Ratio (CLTV),"The total amount you are borrowing in mortgage debts divided by the homes fair market value. Someone with a $50,000 first mortgage and a $20,000 equity line secured against a $100,000 house would have a CLTV ratio of 70%."
155,Commitment Fee,A fee paid by a borrower to a lender in exchange for a promise to lend money on certain terms for a specified period. Usually charged in order to extend a loan approval offer for longer than the 30-60 day standard period. Quality lenders dont usually charge these fees.
156,Conforming Loan,"A mortgage that meets the requirements for purchase by Fannie Mae and Freddie Mac. Requirements include size of the loan, type, and age. Current loan size limits for single-family homes range between $200,000 and $400,000. Loans that exceed the conforming size are considered jumbo mortgages and usually have higher interest rates."
157,Co-Signer,An additional person who signs a loan document and takes equal responsibility for the debt. A borrower may want to use a co-signer if their credit or financial situation is not good enough to qualify for a loan on their own. A co-signer is legally responsible for the loan and the shared account will appear on their credit report.
158,Convenience Check,Checks provided by your credit card company that you can use to access your available credit. These checks often have different rates and terms than your standard credit card charges.
159,Convertible ARM,An adjustable-rate mortgage that can be converted to a fixed-rate mortgage under specified conditions.
160,Credit Bureaus,"Also known as credit reporting agencies, these companies collect information from creditors and lenders about consumer financial behavior. This data is then provided to businesses that want to evaluate how risky it would be to lend money to a potential borrower. Once a low-tech system of regional credit reporting agencies, the industry is now consolidated into the three national credit bureaus - Equifax, Experian, and TransUnion."
161,Credit Counseling,"A service that helps consumers repay their debts and improve their credit. Usually non-profit companies, most of these agencies offer helpful and affordable services. Consumers should be aware that there are also credit counseling agencies that are expensive, ineffective, and even damaging to the clients credit (see Credit Repair). Consumers should carefully review the companys reputation and services before signing up."
162,Credit File,Another term for your credit report. The term credit file is usually used to indicate the full record of your credit history maintained by a credit bureau. Your credit report may not include all the information in your credit file.
163,Credit History,Another term for the information on your credit report. Your credit history is a record of how you have repaid your credit obligations in the past.
164,Credit Insurance,"Protection against loss of life, disability, unemployment, etc. Pays or cancels your monthly payments for a time period if the consumer loses their job through no fault of their own. Policies and protection plans vary. Usually, the monthly fee is based on the amount of the credit card balance."
165,Credit Limit,The total amount that a company will allow you to charge to a credit card or credit line. Its best for your credit score to keep your credit card balances below 10% of your credit limit.
166,Credit Obligation,An agreement where a person becomes legally responsible for paying back borrowed money.
167,Credit Repair,"A generally unscrupulous or illegal form of credit counseling that promises the impossible, such as erasing accurate records from your credit report."
168,Credit Report,"The individual records of consumer financial behavior kept by credit bureaus and provided to businesses when they want to evaluate potential borrowers. Credit reports include records on consumer names, current and former addresses, employment, credit and loan histories, inquiries, collection records, and public records such as bankruptcy filings and tax liens."
